{
  "schema_version": "1.3.0",
  "artefact": "tags",
  "artefact_version": 1,
  "analysis_id": "0192f6c4-8b00-7a00-8000-0000000000aa",
  "user_id": "usr_01JB7Q3K9W2F",
  "audio_hash": "f6ea3271a3f5d48649cb7c1741eafdaad1c65e7879536b91dc998068277be630",
  "sample_rate": 44100,
  "duration_s": 20.5,
  "models": [
    {
      "model_id": "panns/cnn14",
      "version": "mAP=0.431",
      "weights_sha256": "6031a7cfcda816ff3f4d3e1b633b1f5a81f473bd3a3bf4716cb355269a237f2b",
      "provider": "self_hosted",
      "register_tier": "amber"
    }
  ],
  "params": {
    "window_s": 10,
    "top_fraction": 0.25
  },
  "created_at": "2026-10-20T12:00:30Z",
  "window_s": 10,
  "windows": 3,
  "instruments": [
    { "instrument": "guitar", "present_prob": 0.91, "subtype": "electric_guitar" },
    { "instrument": "bass", "present_prob": 0.08 },
    { "instrument": "drums", "present_prob": 0.87 },
    { "instrument": "piano", "present_prob": 0.04, "subtype": "piano" },
    { "instrument": "vocals", "present_prob": 0.62 }
  ]
}
